{
  "conformsTo": "https://data.ed.gov/v1.0/schema/schoolopenstatus",
  "describedBy": "https://data.ed.gov/v1.0/schema/schoolopenstatus.schema.json",
  "statusWeekStartDate": "2021-04-15",
  "openStatus": [
    { "fullyOpen": true,  "schoolId": "10000500870", "schoolName": "Albertville Middle School" },
    { "fullyOpen": false, "schoolId": "10000500871"  },
    { "fullyOpen": false, "schoolId": "10000500879"  },
    { "fullyOpen": false, "schoolId": "10000500889"  },
    { "fullyOpen": true,  "schoolId": "10000501616"  },
    { "fullyOpen": true,  "schoolId": "10000502150", "schoolName": "Albertville Primary School" },
    { "fullyOpen": true,  "schoolId": "10000600872", "schoolName": "Asbury High School" }
  ]
}